{
 "schema": "guji-page/0.1",
 "page_id": "96mid1ogzk/3/3",
 "book": {
  "id": "96mid1ogzk",
  "edition": "siku-zongmu",
  "title": "欽定四庫全書總目（武英殿刻本）"
 },
 "volume": {
  "index": 3,
  "cv_book": "vol03",
  "label": "經部四~五·易類四~五·卷四~卷五",
  "juan_range": "4-5",
  "ia_item": "06061302.cn"
 },
 "page": {
  "index": 3,
  "label": null,
  "page_type": "body"
 },
 "image": {
  "width": 2361,
  "height": 3096,
  "sha256": "05a36191f084309e3638855a836f59f07852a7d66801210af59de863565a9351",
  "path": "data_full/zongmu/vol03/3.png",
  "source": {
   "kind": "ia",
   "item": "06061302.cn",
   "leaf": 3,
   "note": "leaf 号按文件名推定（vol03 拆页只动了 105 及以后），未逐张对 IA scandata"
  }
 },
 "canvas": {
  "id": "https://data.kaiyuanguji.com/iiif/96mid1ogzk/canvas/03/0003",
  "seq": "0003",
  "width": 2361,
  "height": 3096
 },
 "producers": {
  "cv": {
   "tool": "open-guji-cv",
   "rev": "1332c01734",
   "pipeline": "keben_body_v2",
   "steps": {
    "border_detect": "b961082",
    "row_segment": "b961082",
    "cell_shrink": "b961082",
    "seed_admit": "1332c01734"
   },
   "products_sha": {
    "border_detect": "91f86fcbf5c241cafdafac5f4d77f3716bff0e35edb4428a0a6f83043725d6de",
    "row_segment": "e75245ed1f9336b89f116d03b00b2b04b0f48700ddd44cfd934c61f8c0ffadf3",
    "cell_shrink": "39cbbc420aa1701ab6b95f3c020ad67000a90d2ca47d2a209ea8e749cfa4dfe2",
    "seed_admit": "7ec9c73f1fa2fa133882edb4063b412af15cdc9db02dac93ce77954cfe31d63d"
   },
   "snapshot": "guji-workspace snap/96mid1ogzk/vol03/20260928T1708-full"
  },
  "manual": {
   "tool": "manual",
   "who": "F1 道目测（2026-10-02）"
  }
 },
 "text": [
  "欽",
  "定",
  "四",
  "庫",
  "全",
  "書",
  "總",
  "目",
  "卷",
  "四",
  "經",
  "部",
  "四",
  "易",
  "類",
  "四",
  "讀",
  "易",
  "私",
  "言",
  "一",
  "卷",
  "兩",
  "江",
  "總",
  "督",
  "採",
  "進",
  "本",
  "元",
  "許",
  "衡",
  "撰",
  "衡",
  "字",
  "平",
  "仲",
  "河",
  "內",
  "人",
  "官",
  "至",
  "集",
  "賢",
  "殿",
  "",
  "學",
  "士",
  "兼",
  "國",
  "子",
  "祭",
  "酒",
  "諡",
  "文",
  "正",
  "事",
  "迹",
  "具",
  "元",
  "史",
  "本",
  "傳",
  "其",
  "書",
  "論",
  "六",
  "爻",
  "之",
  "德",
  "位",
  "大",
  "㫖",
  "多",
  "發",
  "明",
  "繫",
  "詞",
  "傳",
  "同",
  "功",
  "異",
  "位",
  "柔",
  "危",
  "剛",
  "勝",
  "之",
  "義",
  "而",
  "又",
  "類",
  "聚",
  "各",
  "卦",
  "畫",
  "之",
  "居",
  "於",
  "",
  "",
  "者",
  "分",
  "",
  "觀",
  "之",
  "葢",
  "健",
  "順",
  "動",
  "止",
  "人",
  "說",
  "陷",
  "麗",
  "其",
  "吉",
  "",
  "",
  "",
  "又",
  "",
  "乎",
  "所"
 ],
 "norm": [],
 "zi": [],
 "regions": [
  {
   "id": "r1",
   "kind": "body",
   "box": [
    355,
    352,
    1662,
    2438
   ],
   "rules": [
    [
     [
      2033,
      331
     ],
     [
      2020,
      1159
     ],
     [
      2014,
      1973
     ],
     [
      2014,
      2776
     ]
    ],
    [
     [
      1849,
      331
     ],
     [
      1839,
      1157
     ],
     [
      1837,
      1970
     ],
     [
      1833,
      2776
     ]
    ],
    [
     [
      1662,
      331
     ],
     [
      1652,
      1154
     ],
     [
      1650,
      1968
     ],
     [
      1655,
      2776
     ]
    ],
    [
     [
      1472,
      331
     ],
     [
      1472,
      1151
     ],
     [
      1465,
      1965
     ],
     [
      1467,
      2776
     ]
    ],
    [
     [
      1298,
      331
     ],
     [
      1284,
      1148
     ],
     [
      1282,
      1962
     ],
     [
      1283,
      2776
     ]
    ],
    [
     [
      1108,
      331
     ],
     [
      1100,
      1145
     ],
     [
      1092,
      1960
     ],
     [
      1084,
      2776
     ]
    ],
    [
     [
      926,
      331
     ],
     [
      914,
      1142
     ],
     [
      909,
      1957
     ],
     [
      910,
      2776
     ]
    ],
    [
     [
      741,
      331
     ],
     [
      732,
      1139
     ],
     [
      727,
      1955
     ],
     [
      728,
      2776
     ]
    ],
    [
     [
      555,
      331
     ],
     [
      545,
      1136
     ],
     [
      542,
      1952
     ],
     [
      543,
      2776
     ]
    ],
    [
     [
      367,
      331
     ],
     [
      358,
      1133
     ],
     [
      354,
      1950
     ],
     [
      354,
      2776
     ]
    ]
   ],
   "columns": [
    {
     "id": "c1",
     "n": 1,
     "kind": "body",
     "box": [
      1838,
      352,
      179,
      2438
     ],
     "raised": 0,
     "lead_blank": 0,
     "runs": [
      {
       "lane": "main",
       "text": [
        0,
        10
       ]
      }
     ]
    },
    {
     "id": "c2",
     "n": 2,
     "kind": "body",
     "box": [
      1650,
      352,
      189,
      2438
     ],
     "raised": 0,
     "lead_blank": 0,
     "runs": [
      {
       "lane": "main",
       "text": [
        10,
        13
       ]
      }
     ]
    },
    {
     "id": "c3",
     "n": 3,
     "kind": "body",
     "box": [
      1468,
      352,
      183,
      2438
     ],
     "raised": 1,
     "lead_blank": 0,
     "runs": [
      {
       "lane": "main",
       "text": [
        13,
        16
       ]
      }
     ]
    },
    {
     "id": "c4",
     "n": 4,
     "kind": "body",
     "box": [
      1282,
      352,
      187,
      2438
     ],
     "raised": 1,
     "lead_blank": 0,
     "runs": [
      {
       "lane": "main",
       "text": [
        16,
        22
       ]
      },
      {
       "lane": "jz_r",
       "text": [
        22,
        26
       ]
      },
      {
       "lane": "jz_l",
       "text": [
        26,
        29
       ]
      }
     ]
    },
    {
     "id": "c5",
     "n": 5,
     "kind": "body",
     "box": [
      1095,
      352,
      188,
      2438
     ],
     "raised": 1,
     "lead_blank": 0,
     "runs": [
      {
       "lane": "main",
       "text": [
        29,
        48
       ]
      }
     ]
    },
    {
     "id": "c6",
     "n": 6,
     "kind": "body",
     "box": [
      911,
      352,
      185,
      2438
     ],
     "raised": 0,
     "lead_blank": 0,
     "runs": [
      {
       "lane": "main",
       "text": [
        48,
        67
       ]
      }
     ]
    },
    {
     "id": "c7",
     "n": 7,
     "kind": "body",
     "box": [
      729,
      352,
      183,
      2438
     ],
     "raised": 0,
     "lead_blank": 0,
     "runs": [
      {
       "lane": "main",
       "text": [
        67,
        86
       ]
      }
     ]
    },
    {
     "id": "c8",
     "n": 8,
     "kind": "body",
     "box": [
      543,
      352,
      187,
      2438
     ],
     "raised": 0,
     "lead_blank": 0,
     "runs": [
      {
       "lane": "main",
       "text": [
        86,
        105
       ]
      }
     ]
    },
    {
     "id": "c9",
     "n": 9,
     "kind": "body",
     "box": [
      355,
      352,
      189,
      2438
     ],
     "raised": 0,
     "lead_blank": 0,
     "runs": [
      {
       "lane": "main",
       "text": [
        105,
        124
       ]
      }
     ]
    }
   ]
  }
 ],
 "glyphs": [
  {
   "id": "grxge3a4csi",
   "text": [
    0,
    1
   ],
   "box": [
    1851,
    341,
    177,
    134
   ],
   "col": "c1",
   "lane": "main",
   "slot": 1,
   "cv_id": "vol03:3:1:1",
   "glyph_id": null,
   "by": {
    "box": "cv",
    "text": "cv"
   },
   "method": "cv:occluded_default",
   "review": "pending",
   "conf": null,
   "flags": [
    "occluded"
   ],
   "ext": {
    "cv": {
     "channel": null,
     "doubts": [
      "occluded"
     ],
     "cov": 0.8545
    }
   }
  },
  {
   "id": "gfa74ol2kzo",
   "text": [
    1,
    2
   ],
   "box": [
    1853,
    471,
    174,
    138
   ],
   "col": "c1",
   "lane": "main",
   "slot": 2,
   "cv_id": "vol03:3:1:2",
   "glyph_id": null,
   "by": {
    "box": "cv",
    "text": "cv"
   },
   "method": "cv:occluded_default",
   "review": "pending",
   "conf": null,
   "flags": [
    "occluded"
   ],
   "ext": {
    "cv": {
     "channel": null,
     "doubts": [
      "occluded"
     ],
     "cov": 0.8742
    }
   }
  },
  {
   "id": "guvjhrlyadv",
   "text": [
    2,
    3
   ],
   "box": [
    1849,
    590,
    176,
    115
   ],
   "col": "c1",
   "lane": "main",
   "slot": 3,
   "cv_id": "vol03:3:1:3",
   "glyph_id": null,
   "by": {
    "box": "cv",
    "text": "cv"
   },
   "method": "cv:occluded_default",
   "review": "pending",
   "conf": null,
   "flags": [
    "occluded"
   ],
   "ext": {
    "cv": {
     "channel": null,
     "doubts": [
      "occluded"
     ],
     "cov": 0.9069
    }
   }
  },
  {
   "id": "gruu7r7wu5t",
   "text": [
    3,
    4
   ],
   "box": [
    1854,
    682,
    170,
    149
   ],
   "col": "c1",
   "lane": "main",
   "slot": 4,
   "cv_id": "vol03:3:1:4",
   "glyph_id": null,
   "by": {
    "box": "cv",
    "text": "cv"
   },
   "method": "cv:occluded_default",
   "review": "pending",
   "conf": null,
   "flags": [
    "occluded"
   ],
   "ext": {
    "cv": {
     "channel": null,
     "doubts": [
      "occluded"
     ],
     "cov": 0.9021
    }
   }
  },
  {
   "id": "gscifbhi3eg",
   "text": [
    4,
    5
   ],
   "box": [
    1855,
    811,
    150,
    131
   ],
   "col": "c1",
   "lane": "main",
   "slot": 5,
   "cv_id": "vol03:3:1:5",
   "glyph_id": null,
   "by": {
    "box": "cv",
    "text": "cv"
   },
   "method": "cv:occluded_default",
   "review": "pending",
   "conf": null,
   "flags": [
    "occluded"
   ],
   "ext": {
    "cv": {
     "channel": null,
     "doubts": [
      "occluded"
     ],
     "cov": 0.8518
    }
   }
  },
  {
   "id": "g7ccdqwz6fa",
   "text": [
    5,
    6
   ],
   "box": [
    1854,
    910,
    150,
    156
   ],
   "col": "c1",
   "lane": "main",
   "slot": 6,
   "cv_id": "vol03:3:1:6",
   "glyph_id": null,
   "by": {
    "box": "cv",
    "text": "cv"
   },
   "method": "cv:occluded_default",
   "review": "pending",
   "conf": null,
   "flags": [
    "occluded"
   ],
   "ext": {
    "cv": {
     "channel": null,
     "doubts": [
      "occluded"
     ],
     "cov": 0.9338
    }
   }
  },
  {
   "id": "gbsbc6ttshi",
   "text": [